{
  "schemaVersion": 1,
  "actor": {
    "issuer": "https://login.microsoftonline.com/00000000-0000-4000-8000-000000000001/v2.0",
    "subject": "00000000-0000-4000-8000-000000000002",
    "organizationId": "00000000-0000-4000-8000-000000000003",
    "workspaceId": "00000000-0000-4000-8000-000000000004"
  },
  "bindingRef": "microsoft-graph/office-owner",
  "profileIdempotencyKey": "teams-cloud-office-owner-graph"
}
